Nome,OAB,UF,data,data_ultima_msg,telefone,N_Processo,T_Processo,t_sumarizado
rayane sitonio velasco,52402,df,21-08-2023,nan,6191277644,0709141-77.2017.8.07.0020," - guarda de família  - adv(s).: df52402 - rayane sitonio velasco. adv(s).: df54574 - claudia cunha barreto, df49743 - rogerio dos santos costa. diante do acórdão prolatado pelo e.tjdft (id. 167890591, pp. 01/09), reabre- se a instrução processual para oportunizar a produção da prova pericial psicológica e da prova testemunhal requeridas. - prova pericial psicológica. defiro a realização de prova pericial psicológica por profissional particular, a ser custeada pelo e. tjdft, nos termos da portaria conjunta 53 de 21 de outubro de 2011. -----------------NOMEIO----------------- a perita dra. gabriela pantoja gomes (cpf: 044.571.241-41), psicóloga, e-mail: psi.gabrielapantoja@gmail.com, conveniada ao tribunal, cujos dados encontram-se arquivados na secretaria do juízo, devendo elaborar laudo técnico no prazo de 30 (trinta) dias. anote-se. intime-o(a) para apresentação de proposta de honorários periciais, no prazo de 05 (cinco) dias, atentando-se para os limites indicados no artigo 7º da portaria conjunta 53 de 21 de outubro de 2011, bem como no anexo da portaria conjunta nº 101/2016, uma vez que a perícia será custeada pelo e.tjdft. na oportunidade, o(a) expert deverá justificar, detalhadamente, o quantum solicitado, indicando, assim, o método a ser adotado na realização da perícia e as eventuais ocorrências pertinentes. faculta-se às partes a indicação de assistente técnico, com a apresentação de quesitos, no prazo comum de 15 (quinze) dias, sob pena de preclusão. faculta-se, ainda, a apresentação de quesitos pelo ministério público, também no prazo de 15 (quinze) dias, sob pena de preclusão. - saneamento do feito: designação de audiência de instrução e julgamento. designe-se audiência de instrução e julgamento, a ser realizada por meio virtual (cpc, artigo 367, § 5º), o que promove o aumento da celeridade e da eficiência da prestação jurisdicional, bem como concretiza o princípio constitucional de amplo acesso à justiça, ficando as partes e o ministério público, caso intervenha no feito, advertidos que a oposição à realização do ato por meio virtual deverá ser apresentada no prazo de 05 (cinco) dias, importando o silêncio aceitação tácita à feitura do ato por meio virtual. defiro a oitiva das testemunhas previamente arroladas nos autos (ids. 119501888, p. 02, e 119564765, p. 04). no tocante ao pedido de oitiva da psicóloga p.r.s., registro a impossibilidade de adoção de tal providência, tendo em vista o sigilo médico, ou seja, o dever médico de confidencialidade de toda e qualquer informação de que tiver conhecimento no desempenho de suas funções. advirtam-se as partes que a intimação das testemunhas deverá observar o disposto no artigo 455 do cpc. nas hipóteses do artigo 455, § 4º, do cpc, o cartório deverá proceder às intimações e/ou requisições respectivas. intime- se o ministério público. intimem-se. cumpra-se.0709141-77.2017.8.07.0020","Diante do acórdão prolatado pelo e.tjdft, reabre-se a instrução processual para a produção da prova pericial psicológica e da prova testemunhal requeridas. Foi deferida a realização de prova pericial psicológica por profissional particular, a ser custeada pelo e. tjdft. A perita dra. Gabriela Pantoja Gomes foi nomeada para elaborar o laudo técnico dentro de 30 dias. Ela deverá apresentar proposta de honorários periciais e justificar o quantum solicitado. As partes têm o prazo de 15 dias para indicar assistente técnico e apresentar quesitos. Foi designada audiência de instrução e julgamento a ser realizada por meio virtual. As testemunhas previamente arroladas nos autos serão ouvidas, exceto a psicóloga P.R.S. devido ao sigilo médico. As partes devem observar o disposto no artigo 455 do CPC para a intimação das testemunhas. O Ministério Público também deve ser intimado."
elida gisele perez silva,29656,df,21-08-2023,nan,6185252373,0706250-10.2022.8.07.0020," - procedimento comum cível  - a: maria genuina caetano martins. adv(s).: df28965 - mauricio pereira de souza. r: rosangela araujo neves. adv(s).: to8168 - wesley magno resende holanda, to5078 - raimunda araujo da silva. r: mb gastroenterologia ltda. adv(s).: df29656 - elida gisele perez silva, df54813 - larissa hanna do monte vieira. t: alexandre antonio da silva. adv(s).: nao consta advogado. poder judiciário da união tribunal de justiça do distrito federal e dos territórios 1vacivagcl 1ª vara cível de águas claras número do processo: 0706250-10.2022.8.07.0020 classe judicial: procedimento comum cível (7) requerente: maria genuina caetano martins requerido: rosangela araujo neves, mb gastroenterologia ltda decisão interlocutória diante da manifestação do perito nomeado (id. 165692741), desconstituo, assim, a nomeação do perito dr. alexandre antônio da silva para atuação no presente feito. -----------------NOMEIO----------------- com fulcro no §5º do art. 156 do cpc e no inciso i, do art. 7º da portaria gc 197 de 07/12/16, substituo o perito nomeado pelo dr. luciano dias batista costa médico coloproctologia, crm-df 5560-df, cpf: não informado, com endereço profissional no shls 716, bloco a, sala 408 ? ed. medical center ? setor hospitalar local sul (brasília/df)- cep: 70.390-700, (-----------------NOMEIO----------------- como perito do juízo), que deverá oferecer proposta de honorários no prazo de 15 (quinze) dias, podendo recursar o encargo desde que alegue motivo legítimo (art. 157, cpc). a nomeação do referido profissional se deu em razão do citado profissional ser detentor do conhecimento necessário à realização da perícia, conforme se observa nas petições de id. 162022876 e id. 162174933. em caso de eventual recusa, intimem-se as partes para que promovam a indicação consensual de um médico especialista em coloproctologia, no prazo de 15 (quinze) dias. as partes disporão do prazo de 15 dias para arguir o impedimento ou a suspeição do perito, formulação de quesitos e nomeação de assistente técnico (art. 465, § 1º do cpc). aceito o encargo, venha o depósito pelas partes requeridas, com fulcro no artigo 95 do cpc, no prazo de 5 (cinco) dias, sob pena de inviabilizar a realização da prova e de arcar com o ônus de sua não realização. efetivado o depósito, dê-se vista ao senhor perito para elaboração do laudo, no prazo de 30 (trinta) dias. realizada a perícia, às partes para, querendo, manifestarem-se sobre o laudo do perito do juízo no prazo comum de 15 (quinze) dias, podendo o assistente técnico de cada uma das partes, em igual prazo, apresentar seu respectivo parecer (art. 477, § 1º). ressalte-se que o perito do juízo deverá, no prazo de 15 (quinze) dias, esclarecer ponto: i - sobre o qual exista divergência ou dúvida de qualquer das partes, do juiz ou do órgão do ministério público; ii - divergente apresentado no parecer do assistente técnico da parte. publique-se. águas claras, df, 16 de agosto de 2023 17:04:27. marcia alves martins lobo juíza de direito despacho0701763-60.2023.8.07.0020","No procedimento comum cível, a requerente Maria Genuína Caetano Martins move uma ação contra Rosângela Araújo Neves e a empresa MB Gastroenterologia Ltda. Após a manifestação do perito nomeado, a nomeação do perito Alexandre Antônio da Silva é desconstituída. Em seu lugar, é nomeado o médico coloproctologista Luciano Dias Batista Costa. As partes têm 15 dias para arguir o impedimento ou suspeição do perito, formular quesitos e nomear assistente técnico. Após o depósito do valor pelos requeridos, o perito terá 30 dias para elaborar o laudo. Após a perícia, as partes têm 15 dias para se manifestar sobre o laudo do perito e o assistente técnico de cada uma das partes tem o mesmo prazo para apresentar seu parecer. O perito do juízo deverá esclarecer pontos de divergência no prazo de 15 dias. O despacho foi proferido pela juíza Márcia Alves Martins Lobo, na 1ª Vara Cível de Águas Claras. A decisão foi publicada em 16 de agosto de 2023."
marcelo jose borges,26031,go,18-08-2023,nan,6299753305,0010699-94.2023.5.18.0009," autor ana carollina cunha oliveira advogado maria eugenia neves santana(oab: 27166/go) réu barao especialidades & distribuidora de alimentos sa advogado marcelo jose borges(oab: 26031/go)   intimado(s)/citado(s):    - barao especialidades & distribuidora de alimentos sa               poder judiciário             justiça do intimação fica v. sa. intimado para tomar ciência do despacho id 770f54c proferido nos autos. despacho vistos, etc. determina-se a realização de perícia médica para avaliação das circunstâncias relativas à alegação/agravamento de doençaocupacional (nexo de causalidade, culpa extensão do dano), pelo que -----------------NOMEIO----------------- o(a) dr(a). mariana dalila oliveira silverio. intimem-se a perita para, no prazo de 5 dias, verificar a viabilidade de realizar os trabalhos periciais, bem como para apresentar concordância expressa quanto à nomeação. a ausência de manifestação da perita informando a concordância quanto à nomeação implicará na presunção de recusa, hipótese em que este juízo nomeará outro perito para a realização dos trabalhos periciais. aceito o encargo, deverá o(a) perito(a) avisar necessariamente às partes, do dia, hora e local da realização da perícia, conforme art. 474, do cpc/15, tendo o prazo de 30 (trinta) dias para entrega do respectivo laudo. deverá a perito médica responder aos seguintes quesitos do juízo: 01 - em que circunstâncias o(a) reclamante foi acometido(a) da enfermidade alegada na petição inicial? qual o histórico de saúde do(a) reclamante? ainda que a enfermidade seja preexistente ao contrato de trabalho ou decorrente de fatores orgânicos ou congênitos do(a) reclamante, o exercício da atividade profissional na reclamada atuou como concausa relacionada ao desencadeamento e agravamento? há, portanto, nexo de causalidade direta ou indireta entre a enfermidade e a prestação de serviços na reclamada? 02 - a reclamada adota mecanismos de prevenção contra acidentes e doenças laborais, tais como conscientização dos trabalhadores por meio da semana interna de prevenção de acidentes de trabalho - sipat, cipa e outros métodos sobre a matéria? a mesma possui ppra e pcmso devidamente implantados e em funcionamento? foram realizados os exames necessários, inclusive periódicos, para avaliar a aptidão física e mental do(a) reclamante para o exercício da função? houve omissão ou falha do controle médico preventivo? havia intervalos ou interrupções que neutralizassem o efeito da fadiga física e mental decorrente da atividade laboral de natureza repetitiva? havia necessidade de adaptação ou alteração de função ou setor de trabalho? a postura, o ritmo de trabalho, o mobiliário e as demais condições de trabalho estavam adequados e/ou corretamente adaptados ao(à) reclamante, inclusive de forma ergonômica? houve fornecimento e instrução a respeito do uso de equipamentos de proteção individual? houve treinamento do(a) reclamante para o exercício de sua função? o(a) reclamante já possuía experiência e conhecimento suficientes para o exercício da função? havia fiscalização dos trabalhadores para o fiel cumprimento das normas de segurança do trabalho? 03 - os instrumentos de trabalho eram adequados ao exercício da código para aferir autenticidade deste caderno: 2036433789/2023 tribunal regional do trabalho da 18ª região 2105 data da disponibilização: quinta-feira, 17 de agosto de 2023   função? os mesmos atendiam às especificações de segurança do trabalho? 04 - enfim, teria havido culpa da reclamada? se afirmativo, em que nível (grave, leve ou levíssima)? 05 - em sentido oposto, pode-se afirmar que culpa pelo acidente tenha sido exclusivamente do(a) reclamante? ocorreu caso fortuito ou de força maior (fatos extraordinários, imprevisíveis, fora de controle e sem possibilidade de prevenção por parte do empregador)? 06 - teria ocorrido, na espécie, culpa concorrente? caso afirmativo, favor explicar? 07 - o serviço desempenhado pelo(a) reclamante constitui fator que denota risco especial ou elevado em relação à enfermidade por ele(a) desenvolvida? 08 - houve perda da capacidade laboratícia do(a) reclamante? caso afirmativo, seria em caráter permanente ou temporário? em que grau? ela está apto em exercer a mesma função ou outras atividades profissionais? 09 - há prescrição de tratamento que possa reabilitar o(a) reclamante ou melhorar sua condição física e qualidade de vida? quais e de que forma? 10 - as lesões decorrentes da enfermidade estão consolidadas ou ainda pode haver agravamento e ampliação para outros órgãos ou membros do corpo? concede-se às partes o prazo comum de 5 (cinco) dias para, querendo, apresentar quesitos e indicação de assistentes técnicos, sob pena de preclusão. vindo aos autos o laudo pericial, vista às partes pelo prazo legal. intimem-se. eamr goiania/go, 16 de agosto de 2023.     wanderley rodrigues da silva     juiz do trabalho substituto processo nº atord-0010699-94.2023.5.18.0009","Intimada, a empresa Barão Especialidades & Distribuidora de Alimentos SA foi informada sobre a determinação judicial de realização de perícia médica para avaliar a alegação/agravamento de doença ocupacional. A perita responsável pela avaliação é a Dra. Mariana Dalila Oliveira Silvério, que deverá verificar a viabilidade de realizar os trabalhos periciais e concordar com a nomeação. Caso a perita não se manifeste, será nomeado outro profissional para realizar a perícia. Após aceitar o encargo, a perita deverá comunicar às partes sobre a data, horário e local da realização da perícia, tendo o prazo de 30 dias para entregar o laudo. O juízo apresenta os quesitos que a perita médica deverá responder, abordando temas como o nexo de causalidade entre a enfermidade e a prestação de serviços, a adoção de mecanismos de prevenção pela empresa, adequação dos instrumentos de trabalho, culpa da reclamada, entre outros. As partes têm o prazo de 5 dias para apresentar quesitos e indicação de assistentes técnicos. Após a entrega do laudo pericial, as partes terão acesso ao documento."
jaco carlos silva coelho,13721,go,18-08-2023,nan,6299069000,0010805-71.2023.5.18.0004," autor larissa rodrigues da silva macedo advogado alcilene margarida de carvalho(oab: 16709/go) advogado bruna soares santos garcia(oab: 66863/go) advogado paula coelho soares santos(oab: 44195/go) advogado joao herondino pereira dos santos(oab: 7381/go) réu itau unibanco s.a. advogado jaco carlos silva coelho(oab: 13721/go) perito helder de oliveira andrada   intimado(s)/citado(s):    - larissa rodrigues da silva macedo               poder judiciário             justiça do código para aferir autenticidade deste caderno: 2036433789/2023 tribunal regional do trabalho da 18ª região 1864 data da disponibilização: quinta-feira, 17 de agosto de 2023   intimação fica v. sa. intimado para tomar ciência do despacho id 8627d2e proferido nos autos. despacho defiro o pedido de substituição do perito médico formulado pela parte reclamante (id b38d366 - fls. 1273/1276)para que seja nomeado um médico especialista em psiquiatria para a realização da perícia médica já designada. destituo o perito nomeado, dr. helder de oliveira andrada, agradecendo por sua disponibilidade. intime-o. -----------------NOMEIO----------------- a médica perita, dra. suzy mara maia dos reis alfaia, a quem compete notificar as partes, sob recibo, da data e horário de sua diligência. facultoàs partes a apresentação de quesitos, bem como indicação de assistente técnico, no prazo de 10 (dez) dias.  a expert poderá adotar todas as providências necessárias ao fiel cumprimento do encargo. o prazo para entrega do laudo é de 30 (trinta) dias, devendo os eventuais assistentes técnicos entregarem seus laudos respectivos no mesmo prazo (art. 3º da lei 5584/70). desde já, fica determinado à reclamada que coloque à disposição da perita, caso seja solicitado, cópias dos ltcat, pcmso, pcmat e ppra do período em que o(a) reclamante prestou serviços na empresa, com fundamento no artigo 289 do provimento geral consolidado do egrégio regional. a expert deverá considerar a história clínica da parte reclamante, identificando causas, inclusive preexistentes, que conduziram ao resultado ocorrido, bem como avaliando as normas de segurança e higiene do trabalho adotadas na organização. deverá ainda, à vista da resolução nº 2.183/98, do cfm, manifestar opinião sobre a incapacidade da parte obreira para execução de suas atividades e possível evolução da moléstia, podendo adotar todas as providências necessárias ao fiel cumprimento do encargo. após a entrega do laudo, abra-se vista às partes pelo prazo comum de 10 (dez) dias. com o laudo e a manifestação das partes, voltem os autos conclusos para novas deliberações. caso haja requerimento de “quesitos complementares” ou “esclarecimentos” pelas partes,intime-seo perito a respondê-los, no prazo de 10 (dez) dias, ficando autorizada, desde já, a reiteração da intimação, inclusive por outro meio, caso não atendida a primeira, dentro do prazo concedido. após a apresentação dos esclarecimentos, dê-se vista às partes, pelo prazo comum de 05 dias (art. 477, §1º do cpc/2015).decorrido o prazo concedido às partes, conclusos os autos para designação de audiência de instrução. intimem-se as partes e os peritos. mpm goiania/go, 17 de agosto de 2023.     glenda maria coelho ribeiro     juíza do trabalho substituta processo nº atord-0010805-71.2023.5.18.0004","Autor Larissa Rodrigues da Silva Macedo, réu Itau Unibanco S.A., e perito Helder de Oliveira Andrada foram intimados para tomar ciência do despacho proferido nos autos. O despacho deferiu o pedido de substituição do perito médico formulado pela parte reclamante, nomeando a médica perita Suzy Mara Maia dos Reis Alfaia para a realização da perícia médica já designada. Foi facultada às partes a apresentação de quesitos e a indicação de assistente técnico, no prazo de 10 dias. Ficou determinado à reclamada que coloque à disposição da perita as cópias dos documentos solicitados. Após a entrega do laudo, serão abertas vistas às partes pelo prazo comum de 10 dias. Com o laudo e a manifestação das partes, os autos voltarão para novas deliberações. Caso haja requerimento de ""quesitos complementares"" ou ""esclarecimentos"" pelas partes, o perito deverá respondê-los no prazo de 10 dias. Após a apresentação dos esclarecimentos, será concedido prazo de 5 dias às partes. Decorrido esse prazo, os autos serão conclusos para designação de audiência de instrução."
alcilene margarida de carvalho,16709,go,18-08-2023,nan,6298245979,0010805-71.2023.5.18.0004," autor larissa rodrigues da silva macedo advogado alcilene margarida de carvalho(oab: 16709/go) advogado bruna soares santos garcia(oab: 66863/go) advogado paula coelho soares santos(oab: 44195/go) advogado joao herondino pereira dos santos(oab: 7381/go) réu itau unibanco s.a. advogado jaco carlos silva coelho(oab: 13721/go) perito helder de oliveira andrada   intimado(s)/citado(s):    - larissa rodrigues da silva macedo               poder judiciário             justiça do código para aferir autenticidade deste caderno: 2036433789/2023 tribunal regional do trabalho da 18ª região 1864 data da disponibilização: quinta-feira, 17 de agosto de 2023   intimação fica v. sa. intimado para tomar ciência do despacho id 8627d2e proferido nos autos. despacho defiro o pedido de substituição do perito médico formulado pela parte reclamante (id b38d366 - fls. 1273/1276)para que seja nomeado um médico especialista em psiquiatria para a realização da perícia médica já designada. destituo o perito nomeado, dr. helder de oliveira andrada, agradecendo por sua disponibilidade. intime-o. -----------------NOMEIO----------------- a médica perita, dra. suzy mara maia dos reis alfaia, a quem compete notificar as partes, sob recibo, da data e horário de sua diligência. facultoàs partes a apresentação de quesitos, bem como indicação de assistente técnico, no prazo de 10 (dez) dias.  a expert poderá adotar todas as providências necessárias ao fiel cumprimento do encargo. o prazo para entrega do laudo é de 30 (trinta) dias, devendo os eventuais assistentes técnicos entregarem seus laudos respectivos no mesmo prazo (art. 3º da lei 5584/70). desde já, fica determinado à reclamada que coloque à disposição da perita, caso seja solicitado, cópias dos ltcat, pcmso, pcmat e ppra do período em que o(a) reclamante prestou serviços na empresa, com fundamento no artigo 289 do provimento geral consolidado do egrégio regional. a expert deverá considerar a história clínica da parte reclamante, identificando causas, inclusive preexistentes, que conduziram ao resultado ocorrido, bem como avaliando as normas de segurança e higiene do trabalho adotadas na organização. deverá ainda, à vista da resolução nº 2.183/98, do cfm, manifestar opinião sobre a incapacidade da parte obreira para execução de suas atividades e possível evolução da moléstia, podendo adotar todas as providências necessárias ao fiel cumprimento do encargo. após a entrega do laudo, abra-se vista às partes pelo prazo comum de 10 (dez) dias. com o laudo e a manifestação das partes, voltem os autos conclusos para novas deliberações. caso haja requerimento de “quesitos complementares” ou “esclarecimentos” pelas partes,intime-seo perito a respondê-los, no prazo de 10 (dez) dias, ficando autorizada, desde já, a reiteração da intimação, inclusive por outro meio, caso não atendida a primeira, dentro do prazo concedido. após a apresentação dos esclarecimentos, dê-se vista às partes, pelo prazo comum de 05 dias (art. 477, §1º do cpc/2015).decorrido o prazo concedido às partes, conclusos os autos para designação de audiência de instrução. intimem-se as partes e os peritos. mpm goiania/go, 17 de agosto de 2023.     glenda maria coelho ribeiro     juíza do trabalho substituta processo nº atord-0010805-71.2023.5.18.0004","O texto menciona uma intimação judicial relacionada a um processo trabalhista. A parte reclamante solicitou a substituição do perito médico e foi nomeada uma médica perita para realizar a perícia médica. As partes têm um prazo de 10 dias para apresentar quesitos e indicar assistente técnico. A reclamada deve disponibilizar documentos relacionados à saúde e segurança do trabalho. Após a entrega do laudo, as partes terão um prazo de 10 dias para se manifestarem, e em seguida, os autos serão encaminhados para novas deliberações. Caso haja requerimentos complementares, o perito deverá respondê-los dentro de 10 dias. Após a apresentação dos esclarecimentos, as partes terão um prazo de 5 dias para se manifestarem, e então será designada uma audiência de instrução."
