Nome,OAB,UF,data,data_ultima_msg,telefone,N_Processo,T_Processo,t_sumarizado
maria tereza caetano lima chaves,20620,go,05-09-2023,05-09-2023,6296378123,0010664-61.2023.5.18.0001," autor maicon da silva eugenio advogado priscila silva machado(oab: 47699/go) réu boa vista foods ltda advogado maria tereza caetano lima chaves(oab: 20620/go) réu boa vista - alimentos ltda advogado maria tereza caetano lima chaves(oab: 20620/go) perito marcelo emilio monteiro   intimado(s)/citado(s):    - boa vista - alimentos ltda   - boa vista foods ltda               poder judiciário             justiça do intimação fica v. sa. intimado para tomar ciência do despacho id 9a9948a proferido nos autos. despacho diante da recusa da perita indicada na certidão de id. f402629, destituo a sra. lucia helena meluzzi xavier do encargo.  -----------------NOMEIO-----------------, em substituição, a perita luciana cunha do prado(lucianacunha@expertpericias.net) , telefone: (64) 99955- 8520). a senhora perita deverá informar, no prazo de 05 dias, que tomou ciência da sua nomeação, devendo, no mesmo prazo, informar se aceita o encargo e se realiza perícias em goiânia. o prazo para a entrega do laudo pericial é de 30 dias, a contar da aceitação do encargo. deverá, ainda, cientificar as partes e este juízo, por escrito, sobre a data e o local da realização da perícia. intime-se a sra. perita para ciência da nomeação, bem como para iniciar os trabalhos. mlc goiania/go, 04 de setembro de 2023.     jose luciano leonel de carvalho     juiz do trabalho substituto processo nº atord-0010664-61.2023.5.18.0001","No processo nº atord-0010664-61.2023.5.18.0001, a empresa Boa Vista - Alimentos Ltda e a empresa Boa Vista Foods Ltda foram intimadas para tomar ciência do despacho proferido nos autos. Devido à recusa da perita indicada na certidão, a Sra. Lucia Helena Meluzzi Xavier foi destituída do encargo. Em substituição, foi nomeada a perita Luciana Cunha do Prado, que deve informar se aceita o encargo e se realiza perícias em Goiânia. O prazo para a entrega do laudo pericial é de 30 dias, a contar da aceitação do encargo. Além disso, a perita deverá informar a data e o local da realização da perícia, e iniciar os trabalhos. O despacho foi proferido pelo Juiz do Trabalho Substituto."
gustavo afonso oliveira,34881,go,05-09-2023,05-09-2023,6292650436,0010037-54.2023.5.18.0002," autor roney wesley rodrigues de sousa resende advogado andreia andrade ribeiro(oab: 31310/go) advogado gustavo afonso oliveira(oab: 34881/go) réu ponto 2 comunicacoes ltda - epp réu hnk br industria de bebidas ltda. advogado samuel rios vellasco de amorim(oab: 27497/go) advogado pedro henrique de oliveira batista(oab: 28845/go)perito fernando arthur machado mendes   intimado(s)/citado(s):    - hnk br industria de bebidas ltda.               poder judiciário             justiça do intimação fica v. sa. intimado para tomar ciência do despacho id 7c713df proferido nos autos. despacho considerando a escusa perito judicial fernando arthur machado mendes em assentir ao encargo, destituo-o. -----------------NOMEIO----------------- o perito dr. reinaldo antônio alves júnior – médico ortopedista e traumatologista, crm/go: 22.725, fones: (64) 3623-4636/ 99955-8520, e-mails: reinaldojr@expertpericias.net, periciasrv@gmail.com, mantidas as disposições da ata de audiência id. 3c432d2 . intimem-se as partes, o perito destituído e o novo perito. como medida de economia e celeridade processual, a intimação do perito deverá ser feita por telefone, com certidão nos autos. goiania/go, 04 de setembro de 2023.     ronie carlos bento de sousa     juiz titular de vara do trabalho processo nº atord-0010037-54.2023.5.18.0002","O autor Roney Wesley Rodrigues de Sousa Resende e os advogados Andréia Andrade Ribeiro e Gustavo Afonso Oliveira representam os réus Ponto 2 Comunicações Ltda - EPP e HNK BR Indústria de Bebidas Ltda. Os advogados Samuel Rios Vellasco de Amorim e Pedro Henrique de Oliveira Batista também estão envolvidos no caso. O perito Fernando Arthur Machado Mendes foi destituído e substituído pelo perito Reinaldo Antônio Alves Júnior, um médico ortopedista e traumatologista. A intimação foi feita por telefone para garantir economia e celeridade processual. O despacho foi proferido pelo juiz titular de vara do trabalho, Ronie Carlos Bento de Sousa, no processo nº ATORD-0010037-54.2023.5.18.0002."
flavia oliveira leite,37028,go,05-09-2023,05-09-2023,6298599797,0010638-60.2023.5.18.0002," autor polyanna xavier da rocha advogado flavia oliveira leite(oab: 37028/go) réu ceramica tapuia ltda - epp advogado jacqueline cordeiro nunes(oab: 18394-o/mt) réu tapuia ltda advogado jacqueline cordeiro nunes(oab: 18394-o/mt) réu ceramica trindade ltda - epp advogado jacqueline cordeiro nunes(oab: 18394-o/mt) perito guilherme bernardes pinto perito fernando arthur machado mendes   intimado(s)/citado(s):    - ceramica tapuia ltda - epp   - ceramica trindade ltda - epp   - tapuia ltda               poder judiciário             justiça do intimação fica v. sa. intimado para tomar ciência do despacho id 82cbe6c proferido nos autos. despacho considerando a escusa perito judicial fernando arthur machado mendes em assentir ao encargo, destituo-o. -----------------NOMEIO----------------- o perito dr. reinaldo antônio alves júnior – médico ortopedista e traumatologista, crm/go: 22.725, fones: (64) 3623-4636/ 99955-8520, e-mails: reinaldojr@expertpericias.net, periciasrv@gmail.com, mantidas as disposições da ata de audiência id. 3c432d2 . intimem-se as partes, o perito destituído e o novo perito. código para aferir autenticidade deste caderno: 2043633801/2023 tribunal regional do trabalho da 18ª região 903 data da disponibilização: segunda-feira, 04 de setembro de 2023   como medida de economia e celeridade processual, a intimação do perito deverá ser feita por telefone, com certidão nos autos. goiania/go, 04 de setembro de 2023.     ronie carlos bento de sousa     juiz titular de vara do trabalho processo nº atord-0010638-60.2023.5.18.0002","O autor Polyanna Xavier da Rocha informa que o advogado Flavia Oliveira Leite está representando a ré Cerâmica Tapuia Ltda - EPP, enquanto que o advogado Jacqueline Cordeiro Nunes está representando a ré Tapuia Ltda e a ré Cerâmica Trindade Ltda - EPP. Os peritos Guilherme Bernardes Pinto e Fernando Arthur Machado Mendes também estão envolvidos no caso. O despacho do juiz determina a destituição do perito Fernando Arthur Machado Mendes e nomeia o perito Reinaldo Antônio Alves Júnior para assumir o cargo. A intimação do novo perito será feita por telefone para agilizar o processo."
ricardo goncalez,19301,go,05-09-2023,05-09-2023,6284172016,0010959-32.2022.5.18.0002," autor luzia fabiana de sousa advogado rilvia oliveira da silva alves(oab: 55505/go) réu brasil telecom call center s/a advogado ricardo goncalez(oab: 19301/go)   intimado(s)/citado(s):    - brasil telecom call center s/a               poder judiciário             justiça do intimação fica v. sa. intimado para tomar ciência do despacho id ae7f2df proferido nos autos. despacho verifica-se que foi designada perícia médica em audiência, com indicação do perito fernando arthur machado mendes. contudo, consoante manifestação em outros vários processos, o perito em questão solicita destituição por razões de ordem pessoal. portanto, a fim de corroborar com a celeridade processual, de plano, torno sem efeito a nomeação do perito fernando arthur machado mendes. -----------------NOMEIO----------------- a perita dra. mariana dalila oliveira silvério – médica (psiquiatra), crm/go: 22.838, rqe: 14750, cpf: 003.895.851-14, mantidas as disposições da ata de audiência id. 24888b2 . intimem-se as partes e a nova perita. como medida de economia e celeridade processual, a código para aferir autenticidade deste caderno: 2043633801/2023 tribunal regional do trabalho da 18ª região 948 data da disponibilização: segunda-feira, 04 de setembro de 2023   intimação da perita deverá ser feita por telefone, com certidão nos autos; goiania/go, 04 de setembro de 2023.     alexandre valle piovesan     juiz do trabalho substituto processo nº atsum-0010959-32.2022.5.18.0002","No processo nº ATSUM-0010959-32.2022.5.18.0002, a empresa Brasil Telecom Call Center S/A foi intimada para tomar ciência do despacho proferido nos autos. O despacho informa que foi designada uma perícia médica em audiência, porém o perito indicado, Fernando Arthur Machado Mendes, solicitou sua destituição por motivos pessoais. Com o objetivo de agilizar o processo, a nomeação de Fernando Arthur Machado Mendes foi anulada e a perita Dra. Mariana Dalila Oliveira Silvério, médica psiquiatra, foi nomeada como sua substituta, mantendo-se as disposições da ata de audiência. As partes e a nova perita foram intimadas. A intimação da perita será feita por telefone, com certidão nos autos. A decisão foi proferida em Goiânia, no dia 04 de setembro de 2023."
priscila silva pegorari,5461,to,05-09-2023,05-09-2023,9481087525,0010869-75.2023.5.18.0006," autor maria de lurdes ferreira costa advogado johnathan morais de almeida(oab: 35815/go) réu orion instituto de treinamento e aperfeicoamento em odontologia ltda advogado priscila silva pegorari(oab: 5461/to)   intimado(s)/citado(s):    - maria de lurdes ferreira costa               poder judiciário             justiça do intimação fica v. sa. intimado para tomar ciência do despacho id 6836c57 proferido nos autos. despacho destituo o(a) expert, dr(a). simone adad araujo nomeada do encargo e, em substituição, -----------------NOMEIO----------------- perito(a) médico ortopedista dr(a). marcelo marques teixeira teixeira.marques@gmail.com, telefone: 62 9 83236121), que deverá entregar o laudo na forma e no prazo constante na ata de id d28bdaa - prazo para entrega do laudo: 30 dias. quesitos já apresentados pelas partes. intime-se o(a) perito(a) para que manifeste aceite, agende a data da perícia e inicie os trabalhos. apresentado o laudo, vista às partes pelo prazo comum de 5 dias. ato contínuo, a reclamada requer expedição de ofício ao inss para que seja apresentado cópia integral do processo administrativo e extrato de pagamento (fl. 213). defiro o convênio prevjud para que sejam juntados os prontuários médicos e períodos de afastamento da parte reclamante junto ao inss, bem como os extratos de benefícios recebidos. apresentada resposta, intimem-se as partes para ciência. ciência automática das partes. goiania/go, 04 de setembro de 2023.     israel brasil adourian     juiz titular de vara do trabalho processo nº atord-0010869-75.2023.5.18.0006","Maria de Lurdes Ferreira Costa foi intimada para tomar ciência do despacho proferido nos autos do processo, onde o(a) expert anteriormente nomeado(a) foi destituído(a) do encargo e substituído(a) pelo(a) perito(a) médico ortopedista Marcelo Marques Teixeira. O perito deverá entregar o laudo dentro do prazo estipulado na ata. Após a apresentação do laudo, as partes terão 5 dias para analisá-lo. A reclamada requereu a expedição de ofício ao INSS para obter cópia do processo administrativo e extrato de pagamento. Foi deferido o convênio prevjud para juntar os prontuários médicos e períodos de afastamento da parte reclamante junto ao INSS. Após a apresentação da resposta, as partes serão intimadas para ciência."
flavio silva santana,33754,go,05-09-2023,05-09-2023,6292628701,0010609-62.2023.5.18.0017," autor renato de moraes santos advogado flavio silva santana(oab: 33754/go) réu refrescos bandeirantes industria e comercio ltda advogado yasmin alves de melo(oab: 52736/go) advogado marilia costa martins vaccaro(oab: 25641/go)   intimado(s)/citado(s):    - refrescos bandeirantes industria e comercio ltda               poder judiciário             justiça do intimação fica v. sa. intimado para tomar ciência do despacho id d6f7803 proferido nos autos. despacho requer o autor (4b78744) “a expedição de ofício ao diretor do hospital de urgências governador otávio laje, para que apresente em juízo cópia do prontuário médico do autor, principalmente como se deu a forma de entrada na unidade de saúde.” o prontuário médico consiste no conjunto de documentos que guardam todas as informações referentes ao respectivo paciente, dentre elas, os exames e procedimentos realizados, bem como os dados relativos às suas condições físicas. justamente por conter informações relativas à vida íntima do paciente, o prontuário médico possui caráter sigiloso, e a determinação de sua apresentação em juízo apenas deve ser feita quando tal documento revelar-se indispensável para o deslinde da questão controvertida em análise. ainda assim, é imprescindível a autorização expressa do paciente, sob pena de violação de seu direito fundamental à intimidade, nos termos do art. 5º, x, da cf. frise-se, a exibição, pelo médico, de prontuário sem a devida autorização do paciente inclusive constitui crime de violação do segredo profissional, previsto no art. 154 do código penal.isto posto, ante o seu pedido expresso em audiência de 4b78744, oficie-se ao hospital de urgências governador otávio laje, solicitando cópia de seu prontuário. obtida a informação, arquive-se em pasta própria, com cláusula de segredo de justiça. sem prejuízo, determino a realização de perícia médica para apuração acerca da existência ou não de incapacidade laboral. para tanto, -----------------NOMEIO----------------- como perito judicial o dr helder de oliveira andrada, cpf 632.937.571-20, ortopedista, a fim de que realize a prova técnica necessária, fixando-lhe prazo de 30(trinta) dias, contados a partir do recebimento de sua notificação, para a conclusão do laudo pericial (art. 465, caput do cpc/2015). o perito judicial deverá informar as partes e seus advogados, observando-se os endereços indicados nos autos, acerca da data e horário para a realização da perícia com antecedência mínima de cinco dias, conforme disposto no art. 466, §2º c/c 474 do cpc/2015. faculta-se às partes a indicação de um assistente técnico e formulação de quesitos, no prazo de 15 dias, nos termos do §1º do art. 465 do cpc/2015. as partes serão intimadas para, querendo, manifestar-se sobre o laudo do perito do juízo no prazo comum de 15 (quinze) dias, podendo o assistente técnico de cada uma das partes, em igual prazo, apresentar seu respectivo parecer (art. 477, §1º do cpc/2015). intimem-se as partes e o perito. rns goiania/go, 04 de setembro de 2023.     girlene de castro araújo almeida     juíza do trabalho substituta processo nº atsum-0010609-62.2023.5.18.0017","O autor Renato de Moraes Santos, representado pelo advogado Flavio Silva Santana, move uma ação contra a empresa Refrescos Bandeirantes Indústria e Comércio Ltda. A empresa é representada pelos advogados Yasmin Alves de Melo e Marilia Costa Martins Vaccaro. O autor solicitou que seja expedido um ofício ao diretor do Hospital de Urgências Governador Otávio Laje, a fim de obter o prontuário médico do autor, para esclarecer como ocorreu sua entrada na unidade de saúde. O juiz determinou que a apresentação do prontuário médico em juízo só pode ser feita com autorização expressa do paciente, devido ao caráter sigiloso dessas informações. O juiz também determinou a realização de uma perícia médica para avaliar a existência de incapacidade laboral do autor. O médico perito nomeado é Helder de Oliveira Andrada. As partes têm o direito de indicar um assistente técnico e apresentar quesitos. Após a realização da perícia, as partes terão o prazo de 15 dias para se manifestarem sobre o laudo pericial."
tiago dos santos ribeiro,40046,go,05-09-2023,05-09-2023,6292575904,0010822-10.2019.5.18.0017," autor jutahi teles da costa advogado tiago dos santos ribeiro(oab: 40046/go) réu globo representacao e servicos eireli - me perito marcelo marques teixeira   intimado(s)/citado(s):    - jutahi teles da costa               poder judiciário             justiça do despacho determino a realização de perícia médica para apuração tanto do acidente de trabalho narrado na inicial. para tanto, -----------------NOMEIO----------------- como perito judicial o dr. marcelo marques teixeira, médico do trabalho e ortopedista, a fim de que realize a prova técnica necessária, fixando-lhe prazo de 30 (trinta) dias, contados a partir do recebimento de sua notificação, para a conclusão do laudo pericial (art. 465, caput do cpc/2015). o perito judicial deverá informar as partes e seus advogados, observando-se os endereços indicados nos autos, acerca da data e horário para a realização da perícia com antecedência mínima de cinco dias, conforme disposto no art. 466, §2º c/c 474 do cpc/2015. faculta-se às partes a indicação de um assistente técnico e formulação de quesitos, no prazo de 15 dias, nos termos do §1º do art. 465 do cpc/2015. as partes serão intimadas para, querendo, manifestar-se sobre o laudo do perito do juízo no prazo comum de 15 (quinze) dias, podendo o assistente técnico de cada uma das partes, em igual prazo, apresentar seu respectivo parecer (art. 477, §1º do cpc/2015). intimem-se as partes e o perito. sem prejuízo, em atenção aos princípios do contraditório e da ampla defesa, dê-se vista da petição e documentos juntados pela primeira reclamada sob id. db0359e e id. 0f6fe8d à reclamante. prazo de 5 dias. pmm goiania/go, 04 de setembro de 2023.girlene de castro araújo almeida juíza do trabalho substituta goiania/go, 04 de setembro de 2023. camila carvalho garcia diretor de secretaria processo nº atsum-0010822-10.2019.5.18.0017","Determinada a realização de perícia médica para apuração do acidente de trabalho narrado na inicial. O perito Marcelo Marques Teixeira, médico do trabalho e ortopedista, foi nomeado como perito judicial, com prazo de 30 dias para a conclusão do laudo pericial. As partes serão informadas da data e horário da perícia com antecedência mínima de cinco dias. As partes têm prazo de 15 dias para indicar um assistente técnico e formular quesitos. Após a conclusão do laudo, as partes terão 15 dias para manifestar-se sobre o mesmo, podendo o assistente técnico de cada uma apresentar seu parecer. Foi dada vista da petição e documentos juntados pela primeira reclamada à reclamante, com prazo de 5 dias."
mozart camapum barroso,9978,df,05-09-2023,05-09-2023,6199736274,0010565-89.2023.5.18.0131," autor daniele rodrigues dutra advogado mozart camapum barroso(oab: 9978/df) réu atacadao dia a dia ltda advogado iure de castro silva(oab: 29493/go) perito joaquim goncalves de sousa junior   intimado(s)/citado(s):    - atacadao dia a dia ltda               poder judiciário             justiça do intimação fica v. sa. intimado para tomar ciência do despacho id e11491a código para aferir autenticidade deste caderno: 2043633801/2023 tribunal regional do trabalho da 18ª região 2967 data da disponibilização: segunda-feira, 04 de setembro de 2023   proferido nos autos. despacho ante a manifestação ao #id:c5543af, destituo a perita katharina da camara pinto cremonesi. intimem-na para ciência. -----------------NOMEIO----------------- o perito médico helder de oliveira andrada, cpf: 632.937.571-20, para realização da perícia. intime-se o perito para tomar ciência de sua nomeação nos presentes autos, sendo concedido o prazo de 30 dias para apresentação do laudo, contados de intimação, devendo no mesmo prazo verificar a viabilidade de realizar os trabalhos periciais. algum impedimento, recusa ou qualquer outra manifestação, deverá ser encaminhado de forma escrita a este juízo no prazo de 5 dias. informo, ainda, que é de incumbência do(a) perito(a) avisar as partes acerca do dia e hora designados para a realização da perícia, com antecedência mínima de 02 dias. competirá, ainda, o perito, quando da apresentação do laudo e de sua proposta de honorários, justificar os valores consoante os termos do provimento geral consolidado, atendo-se especificamente, aos requisitos ao seu grau de especialização, complexidade e duração do exame e local da perícia, devidamente comprovados. cumpra-se. acrp luziania/go, 04 de setembro de 2023.     carlos alberto begalles     juiz titular de vara do trabalho processo nº atord-0010565-89.2023.5.18.0131","No processo nº ATORD-0010565-89.2023.5.18.0131, o réu Atacadão Dia a Dia Ltda foi intimado para tomar ciência do despacho proferido nos autos. Neste despacho, foi destituída a perita Katharina da Câmara Pinto Cremonesi e nomeado o perito médico Helder de Oliveira Andrada para realização da perícia. O perito deve tomar ciência de sua nomeação nos presentes autos e apresentar o laudo em um prazo de 30 dias, verificando a viabilidade de realizar os trabalhos periciais. Qualquer impedimento, recusa ou manifestação deve ser encaminhado por escrito ao juízo em um prazo de 5 dias. É responsabilidade do perito avisar as partes sobre o dia e hora da perícia com antecedência mínima de 2 dias. O perito também deve justificar os valores dos honorários de acordo com os termos do provimento geral consolidado. O juiz titular da vara do trabalho é Carlos Alberto Begalles."
iure de castro silva,29493,go,05-09-2023,05-09-2023,6299900455,0010565-89.2023.5.18.0131," autor daniele rodrigues dutra advogado mozart camapum barroso(oab: 9978/df) réu atacadao dia a dia ltda advogado iure de castro silva(oab: 29493/go) perito joaquim goncalves de sousa junior   intimado(s)/citado(s):    - atacadao dia a dia ltda               poder judiciário             justiça do intimação fica v. sa. intimado para tomar ciência do despacho id e11491a código para aferir autenticidade deste caderno: 2043633801/2023 tribunal regional do trabalho da 18ª região 2967 data da disponibilização: segunda-feira, 04 de setembro de 2023   proferido nos autos. despacho ante a manifestação ao #id:c5543af, destituo a perita katharina da camara pinto cremonesi. intimem-na para ciência. -----------------NOMEIO----------------- o perito médico helder de oliveira andrada, cpf: 632.937.571-20, para realização da perícia. intime-se o perito para tomar ciência de sua nomeação nos presentes autos, sendo concedido o prazo de 30 dias para apresentação do laudo, contados de intimação, devendo no mesmo prazo verificar a viabilidade de realizar os trabalhos periciais. algum impedimento, recusa ou qualquer outra manifestação, deverá ser encaminhado de forma escrita a este juízo no prazo de 5 dias. informo, ainda, que é de incumbência do(a) perito(a) avisar as partes acerca do dia e hora designados para a realização da perícia, com antecedência mínima de 02 dias. competirá, ainda, o perito, quando da apresentação do laudo e de sua proposta de honorários, justificar os valores consoante os termos do provimento geral consolidado, atendo-se especificamente, aos requisitos ao seu grau de especialização, complexidade e duração do exame e local da perícia, devidamente comprovados. cumpra-se. acrp luziania/go, 04 de setembro de 2023.     carlos alberto begalles     juiz titular de vara do trabalho processo nº atord-0010565-89.2023.5.18.0131","O autor e o réu foram intimados pela Justiça para tomar conhecimento de um despacho proferido nos autos do processo. Em resposta a uma manifestação, a perita anterior foi destituída e um novo perito médico foi nomeado para realizar a perícia. O perito terá 30 dias para apresentar o laudo e deverá informar as partes sobre a data e hora da perícia com antecedência mínima de 2 dias. O perito também deverá justificar os valores dos honorários de acordo com os critérios estabelecidos. O despacho foi assinado pelo juiz titular da vara do trabalho. O número do processo é ATORD-0010565-89.2023.5.18.0131."
