Nome,OAB,UF,data,data_ultima_msg,telefone,N_Processo,T_Processo,t_sumarizado
ana maria da silva oliveira; rep(s),43791,df,31-08-2023,nan,6192780721,0719658-49.2023.8.07.0015," - carta precatória cível  - a: a. j. g. m.. adv(s).: df43791 - ana maria da silva oliveira; rep(s).: geralda goncalves rodrigues guedes. r: bradesco auto re companhia de seguros. adv(s).: mg123907 - jackson freire jardim dos santos. poder judiciário da união tribunal de justiça do distrito federal e dos territórios vprecdf vara de precatórias do df fórum júlio fabbrini mirabete, srtvs, quadra 701, bloco n, 6º andar, sala 6.10, asa sul, brasília, distrito federal, telefones 3103-1631 / 3103-1633 e-mail: vprecdf@tjdft.jus.br. horário de atendimento: 12h às 19h. carta precatória: 0719658-49.2023.8.07.0015 requerente: a. j. g. m. representante legal: geralda goncalves rodrigues guedes requerido: bradesco auto re companhia de seguros decisão vistos, cuida-se de carta precatória expedida para realização de perícia. regularmente instruído os autos, -----------------NOMEIO----------------- o perito andré luis giusti, cpf nº 986.882.001-49, telefones (61) 99500-6776 e (61) 9950-0677, e-mail medicinagiusti@bol.com.br, regularmente inscrito(a) na tabela do tjdft. intime-se o perito para, no prazo de 5 (cinco) dias, dizer se aceita o encargo e apresentar proposta de honorários fundamentada, com a estimativa de horas de trabalho e valor da hora-base, currículo, com comprovação de especialização e contatos profissionais. ressalto que as intimações pessoais serão realizadas pelo dje, devendo o expert cadastrar-se junto ao pje para essa finalidade. fixo o prazo de 30 dias para a entrega do laudo pericial, que deverá observar o disposto no art. 473, do cpc. ressalto, por oportuno, a necessidade de observância pelo perito do disposto no §2º do art. 466 e no art. 474, ambos do cpc, devendo informar às partes acerca da data e local de início para a realização do exame pericial, bem como informar aos assistentes técnicos, com antecedência mínima de 5 dias, a realização de diligências e exames. na sequência, abra-se vista às partes acerca dos honorários do perito. prazo: 5 dias. ausente impugnação de quaisquer das partes, intime-se a parte requerida para depositar os honorários do perito. prazo: 3 dias. consigne-se que o levantamento dos honorários periciais ocorrerá da seguinte forma: 50% após a entrega do laudo pericial, e o restante após a sua homologação, nos termos do art. 465, §4º do cpc. intimem-se. brasília-df, 25 de agosto de 2023 16:29:53. robert kirchhoff berguerand de melo juiz de direito substituto0719658-49.2023.8.07.0015","Trata-se de uma carta precatória cível expedida para realização de perícia. O perito André Luis Giusti foi nomeado para o encargo e deverá apresentar proposta de honorários, currículo e contatos profissionais. Foi fixado prazo de 30 dias para a entrega do laudo pericial, ressaltando-se a necessidade de informar às partes e aos assistentes técnicos sobre a data e local de realização do exame pericial. Após a apresentação das propostas, as partes terão prazo para impugnação e, caso não haja impugnação, a parte requerida deverá depositar os honorários do perito. O levantamento dos honorários ocorrerá de forma parcelada, sendo 50% após a entrega do laudo pericial e o restante após a sua homologação."
carla ibanhes de jesus sales,65181,df,31-08-2023,nan,6294592325,0705474-16.2022.8.07.0018," - procedimento comum cível  - a: derisvaldo ferreira dantas. adv(s).: df65181 - carla ibanhes de jesus sales. r: distrito federal. adv(s).: nao consta advogado. r: instituto de gestão estratégica de saúde do distrito federal - igesdf. adv(s).: df65833 - tullio cunha nogueira aguiar, df14308 - radam nakai nunes, df19310 - guilherme vieira nunes bandeira, df22997 - ana paula ferreira boucas chaves, df49232 - danielle duarte abiorana. t: eduardo de almeida campos. adv(s).: nao consta advogado. poder judiciário da união tribunal de justiça do distrito federal e dos territórios 3vafazpub 3ª vara da fazenda pública do df número do processo: 0705474-16.2022.8.07.0018 classe judicial: procedimento comum cível (7) - erro médico (10434) autor: derisvaldo ferreira dantas reu: distrito federal requerido: instituto de gestão estratégica de saúde do distrito federal - igesdf decisão -----------------NOMEIO----------------- em substituição o dr. antonio carvalho da silva, médico oftalmologista, carvalhodasilvaantonio@gmail.com, (61) 98552-1805. intimem-se. brasília - df, 28 de agosto de 2023 andré gomes alves juiz de direito substituto (assinado eletronicamente)0706493-23.2023.8.07.0018","Em um procedimento comum cível, o autor Derisvaldo Ferreira Dantas move uma ação contra o Distrito Federal e o Instituto de Gestão Estratégica de Saúde do Distrito Federal (IGESDF), alegando erro médico. O Juiz de Direito Substituto nomeia o Dr. Antonio Carvalho da Silva como substituto, um médico oftalmologista. A decisão é datada de 28 de agosto de 2023."
 rafael albertoni faganello ,336917,sp,30-08-2023,nan,3488749258,1000376-04.2023.8.26.0053," 1000376-04.2023.8.26.0053 - procedimento comum cível -  auxílio-doença acidentário - carlos rodrigo de almeida - vistos. prossiga-se com o regular andamento do feito.  -----------------NOMEIO----------------- perito o dr. gilberto de castro brandão, facultando-se às partes o acompanhamento por seus assistentes t écnicos. cadastrem-se nome e demais dados do perito no sistema saj. cadastrem-se também no portal os dados solicitados  para cada perito nomeado. designo a perícia médica para o dia 26 de outubro de 2023, às 15:45 horas. deverá o(a) patrono( a) providenciar o comparecimento da parte autora à perícia, na divisão de perícias médicas acidentárias, situada no fórum r egional iii - jabaquara, rua afonso celso, 1065, bloco 2, 2º andar, vila mariana, são paulo-sp (próximo à estação santa cruz  do metrô), sob pena de extinção do feito em caso de ausência (artigo 485, inciso iii, do código de processo civil). a parte deverá chegar com 15 (quinze) minutos de antecedência para a realização da perícia. a presença de acompanhantes fica restrit a aos casos em que seja indispensável para o deslocamento e cuidado da parte autora. intime-se o inss a proceder a anteci pação dos honorários periciais, nos termos do disposto na lei nº 13.876/19, com a redação dada pela lei nº 14.331/22, que fix o em r$ 534,87 (quinhentos e trinta e quatro reais e oitenta e sete centavos), nos termos da portaria nº 1/2023, dos juízes da s varas de acidentes do trabalho da capital, no prazo de até 30 dias, comunicando o juízo quando da efetivação do depósito. proceda o sr. perito à anamnese e exame físico, bem como à análise dos exames que sejam trazidos pelo autor, observando a ordem de serviço da divisão de perícias acidentárias vigente, apresentando o respectivo laudo médico, oportunidade e m que deverá também responder aos quesitos propostos pelo cnj. caso haja necessidade de realização de exames complem entares complexos, tais como ressonância magnética, eletroneuromiografia ou tomografia, dentre outros, deverá o per ito consultar o juízo quanto à possibilidade de sua realização,  justificando a necessidade. nessa hipótese, intimem-se as parte s para manifestação e após, venham conclusos para decisão. anoto que a justiça gratuita decorre da lei 8.213/91 (art. 129,  parágrafo único), sendo desnecessária declaração. incumbe às partes, dentro de 15 (quinze) dias contados da intimação desta decisão, indicar assistente técnico (artigo 465, parágrafo 1º, inciso ii, do código de processo civil). em caso de inobservânc ia do prazo, a participação do assistente técnico será vedada na avaliação pericial e na apresentação de quesitos, para garan tia do contraditório e da ampla defesa. aplica-se à indicação d o assistente técnico a exclusividade da atividade de médico na re alização de perícia (artigo 4º, inciso xii, e 5º, inciso ii, am bos da lei 12.842/2013). intimem-se. são paulo, 28 de agosto de 2023. - adv: rafael albertoni faganello (oab 336917/sp)processo","O processo 1000376-04.2023.8.26.0053 trata de um procedimento comum cível referente ao auxílio-doença acidentário de Carlos Rodrigo de Almeida. O juiz determinou a nomeação do perito Dr. Gilberto de Castro Brandão, permitindo que as partes sejam acompanhadas por seus assistentes técnicos. Os dados do perito devem ser cadastrados no sistema SAJ e também no portal. A perícia médica foi designada para o dia 26 de outubro de 2023, às 15:45 horas, e o advogado responsável pela parte autora deve providenciar sua presença na divisão de perícias médicas acidentárias. Caso a parte autora não compareça, o processo poderá ser extinto. A presença de acompanhantes só é permitida em casos indispensáveis. O INSS foi intimado a antecipar os honorários periciais, conforme a lei nº 13.876/19, no valor de R$ 534,87, e deve comunicar o juízo quando fizer o depósito. O perito deve realizar a anamnese, exame físico e análise de exames, apresentando o laudo médico e respondendo aos quesitos propostos pelo CNJ. Em casos de exames complementares complexos, o perito deve consultar o juízo e justificar a necessidade. As partes têm 15 dias para indicar assistente técnico, sendo que a não observância desse prazo impedirá a participação do assistente técnico na avaliação pericial e na apresentação de quesitos. A exclusividade da atividade de médico na realização de perícia também se aplica à indicação do assistente técnico."
 flávio faibischew prado ,206733,sp,30-08-2023,nan,1191893337,1049776-84.2023.8.26.0053," 1049776-84.2023.8.26.0053 - procedimento comum cível -  auxílio-acidente (art. 86) - daniel pereira gomes de sá - 1) para a avaliação na divisão de perícias acidentárias , localizada no fórum regional iii - jabaquara - rua afonso celso, 1065, bloco 2 - 2º pavimento - sala 205 - vila ma riana (ponto de referência metrô santa cruz) - cep: 04119-061 - são paulo/sp, -----------------NOMEIO----------------- o(a) perito(a) judicial doutor(a) gi lberto de castro brandão, que deverá analisartodas as queixas narradas na inicial. 2) de acordo com a pauta, designo perícia médica para 30 de outubro de 2023, às 14h30 horas. para que não haja manuseio de documentos durante o exame, todos os laudo s e exames anteriormente realizados, deverão já estar previamente juntados aos autos. aceito a indicação de assistent e técnico e dos quesitos apresentados. 3) intime-se o inss a proceder a antecipação dos honorários periciais, nos termos do disposto na lei nº 14.331/22, que fixo em r$ 534,87 (quinhentos  e trinta e quatro reais e oitenta e sete centavos), nos termos da portaria nº 001/2023, dos juízes das varas de acidentes do trabalho da capital, no prazo de até 30 dias, comunicando o juí zo quando da efetivação do depósito. 4) proceda o sr. perito à anamnese e exame físico, bem como à análise dos exames que seja m trazidos pelo autor, observando a ordem de serviço nº 01/2022 da divisão de perícias acidentárias, apresentando o res pectivo laudo médico, oportunidade em que deverá também responder aos quesitos propostos pelo cnj e por este juízo. que sitos do juízo: sequelas do acidente ou doença profissional: 1- há documentos e prontuário médico que comprove m o acidente ou início do tratamento da enfermidade? 2- há necessidade de mais exames complementares para a melhor a nálise? nexo causal ou concausal: 1- o nexo causal é direto com o acidente ou doença profissional? 2- há co ncausa por agravamento com a atividade profissional? grau de incapacidade: 1- total e temporária por quanto tempo de trat amento para nova avaliação? 2- parcial e permanente? 3- invalidez acidentária total e permanente? 5) caso haja neces sidade de realização de exames complementares complexos, tais como ressonância magnética, eletroneuromiografia ou tomogr afia, dentre outros, deverá o perito consultar o juízo quanto à possibilidade de sua realização, justificando a necessidade. nessa hipótese, intimem-se as partes para manifestação e após, venham conclusos para decisão. 6) cadastrem-se o nome e demais dados do perito no saj. cadastrem-se também no portal os dados solicitados para cada perito nomeado. 7) intime-se o(a ) autor(a)da data da perícia, na pessoa do(a) advogado(a), o(a) qual se incumbirá de comunicar e cientificar o cliente, de  que a ausência implicará no julgamento no estado. 8) anoto que  a justiça gratuita decorre da lei 8.213/91 (art. 129, parágrafo  único), sendo desnecessária declaração. anote-se. 9) incumbe às partes, dentro de 15(quinze) dias contados da intimação dest a decisão, indicar assistente técnico (artigo 465, parágrafo 1º , inciso ii, do código e processo civil). em caso de inobservânci a do prazo, a participação do assistente técnico será vedada na  avaliação pericial e na apresentação de quesitos, para garantia  do contraditório e da ampla defesa. aplica-se à indicação do assistente técnico a exclusividade da atividade de médico na re alização de perícia (artigo 4º, inciso xii, e 5º, nciso ii, amb os da lei 12.842/2013). 10) juntado o laudo, cite-se o inss para a presentar resposta no prazo legal, oportunidade em que deverá juntar o extrato de dossiê previdenciário e o dossiê médico, be m como expeça-se o mle em favor do perito judicial, ou cobre-se  do inss o depósito e, quando realizado, expeça-se o mle. decorr ido o prazo de resposta, diga o autor sobre o laudo e eventual contestação e venham conclusos. - adv: flávio faibischew prado (oab 206733/sp)processo","No processo 1049776-84.2023.8.26.0053, referente ao auxílio-acidente (art. 86), Daniel Pereira Gomes de Sá requer a avaliação na Divisão de Perícias Acidentárias, localizada no Fórum Regional III - Jabaquara - São Paulo/SP. O perito judicial designado é o Dr. Gilberto de Castro Brandão, que analisará todas as queixas narradas na inicial. A perícia médica está marcada para o dia 30 de outubro de 2023, às 14h30. O INSS deve antecipar os honorários periciais no valor de R$ 534,87, conforme estabelecido pela lei nº 14.331/22, em até 30 dias. O perito realizará a anamnese, exame físico e análise dos exames trazidos pelo autor, apresentando o laudo médico e respondendo aos quesitos propostos pelo CNJ e pelo juízo. Caso sejam necessários exames complementares complexos, será consultado o juízo para autorização. O nome e os dados do perito devem ser cadastrados no SAJ e no portal. O autor será intimado da data da perícia, sendo responsabilidade do advogado comunicar o cliente, sob pena de julgamento à revelia. A justiça gratuita é garantida pela lei 8.213/91, sem necessidade de declaração. As partes têm 15 dias para indicar assistente técnico, sendo vedada a participação caso o prazo não seja observado. Após a juntada do laudo, o INSS será citado para apresentar resposta, juntamente com o extrato de dossiê previdenciário e dossiê médico."
 jonathan braz de lima fernandes ,46034,sc,30-08-2023,nan,4898205285,1011705-43.2021.8.26.0001," 1011705-43.2021.8.26.0001 - procedimento comum cível -  indenização por dano moral - luiz felippe gomes barbosa da silva - katia fernandez araujo - eclaro o processo s aneado. é fato incontroverso: o negócio jurídico pactuado entre  as partes compra de animal da raça maltês. são questões de fato  controvertidas: o estado de saúde do animal no momento da compra, suposto conhecimento da vendedora em relação ao defeito  congênito, eventual substituição do animal no momento da realização dos exames juntados. determino a produção de prov a documental consistente na juntada, em cartório, no prazo de 15 dias, dos originais dos documentos de fls. 306/341, bem c omo de qualquer outro exame que se refira ao animal. defiro, ainda, a produção de prova pericial indireta a ser realizada po r médico veterinário, dos documentos originais trazidos pela pa rte autora, e -----------------NOMEIO----------------- para o ato a médica veterinária ana paula brag a gomez, que deverá ser intimada, via portal, a fim de que informe se aceita o encargo, estimando os seus honorários, que serão adiantados pela parte autora, que requereu a prova. são quesitos deste juízo os seguintes: 1- é possível afirmar que o animal indicado nos exames de fls. 306/341 possuiria a mesma idade e condições compatíveis com o animal nascido na data de 2 9/07/2018? 2- o problema congênito apresentado deveria ser de conhecimento da vendedora no momento da entrega do anima l em 15/10/2018? 3- é possível que a questão congênita apresentada tenha permanecido oculta mesmo após a realização do s exames usuais? 4- o animal indicado às fls. 324/341 era castrado? a anomalia genética apresentada justificaria a ca stração do animal? caso o animal tenha sido adquirido para reprodução, quais motivos poderiam levar à castração? às partes  para que, em 15 dias, apresentem os quesitos. a conveniência da prova testemunhal será analisada oportunamente após a realiz ação da perícia. intime-se. - adv: thiago ataide sodre (oab 135423/mg), jonathan braz de lima fernandes (oab 46034/sc)processo","No processo 1011705-43.2021.8.26.0001, envolvendo Luiz Felippe Gomes Barbosa da Silva e Katia Fernandez Araujo, é mencionado que o negócio jurídico firmado entre as partes diz respeito à compra de um animal da raça maltês. É destacado que há controvérsias em relação ao estado de saúde do animal no momento da compra, ao suposto conhecimento da vendedora sobre um defeito congênito e à possível substituição do animal durante a realização dos exames apresentados. Foi determinada a produção de provas documentais, com prazo de 15 dias para a apresentação dos documentos originais, bem como de outros exames relacionados ao animal. Além disso, foi autorizada a produção de prova pericial indireta, a ser realizada por um médico veterinário, e a veterinária Ana Paula Braga Gomez foi nomeada para tal função. Os quesitos a serem respondidos pela perícia incluem a idade e as condições do animal indicado nos exames, se a vendedora deveria conhecer o problema congênito, se a questão congênita poderia ter permanecido oculta mesmo após os exames usuais e se o animal indicado era castrado, entre outros. As partes têm 15 dias para apresentar seus quesitos. A conveniência de testemunhas será analisada posteriormente à realização da perícia."
 thiago ataide sodre ,135423,mg,30-08-2023,nan,2899661797,1011705-43.2021.8.26.0001," 1011705-43.2021.8.26.0001 - procedimento comum cível -  indenização por dano moral - luiz felippe gomes barbosa da silva - katia fernandez araujo - eclaro o processo s aneado. é fato incontroverso: o negócio jurídico pactuado entre  as partes compra de animal da raça maltês. são questões de fato  controvertidas: o estado de saúde do animal no momento da compra, suposto conhecimento da vendedora em relação ao defeito  congênito, eventual substituição do animal no momento da realização dos exames juntados. determino a produção de prov a documental consistente na juntada, em cartório, no prazo de 15 dias, dos originais dos documentos de fls. 306/341, bem c omo de qualquer outro exame que se refira ao animal. defiro, ainda, a produção de prova pericial indireta a ser realizada po r médico veterinário, dos documentos originais trazidos pela pa rte autora, e -----------------NOMEIO----------------- para o ato a médica veterinária ana paula brag a gomez, que deverá ser intimada, via portal, a fim de que informe se aceita o encargo, estimando os seus honorários, que serão adiantados pela parte autora, que requereu a prova. são quesitos deste juízo os seguintes: 1- é possível afirmar que o animal indicado nos exames de fls. 306/341 possuiria a mesma idade e condições compatíveis com o animal nascido na data de 2 9/07/2018? 2- o problema congênito apresentado deveria ser de conhecimento da vendedora no momento da entrega do anima l em 15/10/2018? 3- é possível que a questão congênita apresentada tenha permanecido oculta mesmo após a realização do s exames usuais? 4- o animal indicado às fls. 324/341 era castrado? a anomalia genética apresentada justificaria a ca stração do animal? caso o animal tenha sido adquirido para reprodução, quais motivos poderiam levar à castração? às partes  para que, em 15 dias, apresentem os quesitos. a conveniência da prova testemunhal será analisada oportunamente após a realiz ação da perícia. intime-se. - adv: thiago ataide sodre (oab 135423/mg), jonathan braz de lima fernandes (oab 46034/sc)processo","No processo 1011705-43.2021.8.26.0001, trata-se de um procedimento comum cível de indenização por dano moral movido por Luiz Felippe Gomes Barbosa da Silva contra Katia Fernandez Araujo. Foi esclarecido que o negócio jurídico entre as partes diz respeito à compra de um animal da raça maltês. As questões de fato controversas são o estado de saúde do animal no momento da compra, o suposto conhecimento da vendedora sobre o defeito congênito e a possível substituição do animal durante os exames juntados. Foi determinada a produção de prova documental, com prazo de 15 dias, para a apresentação dos originais dos documentos e exames relacionados ao animal. Também foi autorizada a produção de prova pericial indireta, a ser realizada por um médico veterinário, para avaliar os documentos trazidos pela parte autora. A médica veterinária Ana Paula Braga Gomez foi nomeada para o ato e deverá informar se aceita o encargo e estipular os honorários, que serão adiantados pela parte autora. Os quesitos definidos pelo juízo são: 1) a possibilidade de afirmar se o animal indicado nos exames possui a mesma idade e condições compatíveis com o animal nascido em 29/07/2018; 2) se o problema congênito deveria ser conhecido pela vendedora no momento da entrega do animal em 15/10/2018; 3) a possibilidade de a questão congênita ter permanecido oculta mesmo após a realização dos exames usuais; 4) se o animal indicado nas fls. 324/341 era castrado e se a anomalia genética apresentada justificaria tal castração. As partes têm 15 dias para apresentar os quesitos. A conveniência da prova testemunhal será avaliada após a realização da perícia."
